{
  "$schema": "http://json-schema.org/draft-07/schema#",
  "title": "equipment_schema",
  "description": "Schema for representing equipment information",
  "type": "object",
  "required": [
    "name",
    "equipment_description",
    "rarity"
  ],
  "properties": {
    "name": {
      "description": "Readable name of equipment",
      "type": "string"
    },
    "equipment_description": {
      "description": "Main equipment description",
      "type": "string"
    },
    "rarity": {
      "description": "Rarity of the equipment item(s)",
      "type": "string",
      "enum": [
        "Common",
        "Uncommon",
        "Rare",
        "Very rare",
        "Legendary"
      ]
    },
    "tags": {
      "description": "List of properties for the equipment",
      "type": "array",
      "items": {
        "type": "string"
      }
    }
  }
}