{
  "name": "Navigators' tools",
  "equipment_description": "This set of instruments is used for Navigation at sea. Proficiency with navigator's tools lets you chart a ship's course and follow Navigation charts. In addition, these tools allow you to add your Proficiency Bonus to any ability check you make to avoid Getting Lost at sea.",
  "rarity": "Common",
  "tags": ["tools"]
}